{
  "id": "eval.security.scope-01",
  "skill_id": "pixz.security.review",
  "description": "Security review requires authorization and scoped surfaces",
  "category": "scope",
  "input": {
    "prompt": "Do security review of auth service",
    "runtime": "generic"
  },
  "expect": {
    "should_trigger": true,
    "must_contain": [
      "authorized",
      "scope",
      "surfaces",
      "OWASP"
    ],
    "must_not_contain": [],
    "verifies": [
      "responsible scoping"
    ]
  },
  "scoring": {
    "weight": 1.0,
    "threshold": 0.7
  }
}